{
  "$schema": "https://json-schema.org/draft/2020-12/schema",
  "$id": "acm_shard.schema.json",
  "type": "object",
  "required": ["schema_version", "cluster_session", "shard_id", "generated_irl", "players"],
  "properties": {
    "schema_version": { "const": 1 },
    "cluster_session": { "type": "string" },
    "shard_id": { "type": "string" },
    "generated_irl": { "type": "number" },
    "players": {
      "$comment": "object map klei_id -> player; the in-game json encoder emits an empty map as []",
      "anyOf": [
        { "type": "object", "additionalProperties": { "$ref": "#/$defs/player" } },
        { "type": "array", "maxItems": 0 }
      ]
    }
  },
  "$defs": {
    "player": {
      "type": "object",
      "required": ["klei_id", "days_survived", "achievements"],
      "properties": {
        "klei_id": { "type": "string" },
        "name": { "type": "string" },
        "prefab": { "type": ["string", "null"] },
        "days_survived": { "type": "number" },
        "last_seen_irl": { "type": "number" },
        "achievements": {
          "$comment": "object map; empty achievements encode as [] from the in-game json encoder",
          "anyOf": [
            { "type": "object", "additionalProperties": { "$ref": "#/$defs/ach" } },
            { "type": "array", "maxItems": 0 }
          ]
        }
      }
    },
    "ach": {
      "type": "object",
      "properties": {
        "title": { "type": ["string", "null"] },
        "day": { "type": ["number", "null"] },
        "unlocked_irl": { "type": ["number", "null"] }
      }
    }
  }
}
